Επαρχία; Σημείο Δειγματοληψίας; Ωράριο; LAT; LON; googlemap
Λεμεσός; Εκκλησία Αγίου Ιωάννη Ελεήμων, Λεμεσός; 8.30 π.μ.-5.30 μ.μ.; 34.674712; 33.020708; https://www.google.com/maps/place/34.674712,33.020708
Λεμεσός; Κτήριο ΤΕΠΑΚ «Αντρέας Θεμιστοκλέους», Αγία Ζώνη (Παλαιό Κτηματολόγιο Λεμεσού, Οδός Αθηνών); 8.30 π.μ.-5.30 μ.μ.; 34.676206; 33.044585; https://www.google.com/maps/place/34.676206,33.044585
Λεμεσός; Εκκλησία Αποστόλων Πέτρου και Παύλου, Κάψαλος; 8.30 π.μ.-5.30 μ.μ.; 34.7048011; 32.9932362; https://www.google.com/maps/place/34.7048011,32.9932362
Λεμεσός; Χώρος στάθμευσης αρτοποιείου «Σίγμα», Κάψαλος (Οδός Αγίας Φυλάξεως, δίπλα από Scandia); 8.30 π.μ.-5.30 μ.μ.; 34.700944; 33.030465; https://www.google.com/maps/place/34.700944,33.030465
Λεμεσός; Εκκλησία Παναγίας Ευαγγελίστριας, Κάτω Πολεμίδια; 8 π.μ.-4 μ.μ.; 34.693854; 33.000363; https://www.google.com/maps/place/34.693854,33.000363
Λεμεσός; Τσίρειο Στάδιο (Δυτική Πλευρά Κύρια Είσοδος, χώρος επισήμων); 8 π.μ.- 4 μ.μ.; 34.700932; 33.021789; https://www.google.com/maps/place/34.700932,33.021789
Λεμεσός; Πλατεία «Ειρήνης», Αγιος Αθανάσιος (μπροστά από το Δημαρχείο); 8.30 π.μ.-5.30 μ.μ.; 34.710038; 33.050999; https://www.google.com/maps/place/34.710038,33.050999
Λεμεσός; Κέντρο Παραγωγικότητας, Λινόπετρα (δίπλα από τον χώρο στάθμευσης, Οδός Ελπίδος 1); 8.30 π.μ.-5.30 μ.μ.; 34.701769; 33.064427; https://www.google.com/maps/place/34.701769,33.064427
Λεμεσός; Ιερός Ναός Αγίας Βαρβάρας, Ζακάκι; 8.30 π.μ.-5.30 μ.μ.; 34.658749; 33.000978; https://www.google.com/maps/place/34.658749,33.000978
Λεμεσός; Ξενοδοχείο Atlantica Oasis, Γερμασόγεια (προθάλαμος ξενοδοχείου); 8.30 π.μ.-5.30 μ.μ.; 34.700879; 33.098411; https://www.google.com/maps/place/34.700879,33.098411
Λεμεσός; Πολιτιστικό Κέντρο Δήμου Γερμασόγειας; 8.30 π.μ.-5.30 μ.μ.; 34.719661; 33.084520; https://www.google.com/maps/place/34.719661,33.084520
Λεμεσός; Κοινοτικό Συμβούλιο Τραχωνίου; 8.30 π.μ.-5.30 μ.μ.; 34.658288; 32.966485; https://www.google.com/maps/place/34.658288,32.966485
Λεμεσός; Εκκλησία Παναγίας Χρυσαϊφυλιώτισσας, Αγία Φύλα; 8.30 π.μ.-5.30 μ.μ.; 34.690951; 33.035506; https://www.google.com/maps/place/34.690951,33.035506
Λάρνακα; Πολιτιστικό Κέντρο «Αγίου Γεωργίου Κοντού», Λάρνακα; 8.30 π.μ.-5.30 μ.μ.; 34.924908; 33.610432; https://www.google.com/maps/place/34.924908,33.610432
Λάρνακα; Δημοτικό Θέατρο Λάρνακας; 8.30 π.μ.-5.30 μ.μ.; 34.916106; 33.626317; https://www.google.com/maps/place/34.916106,33.626317
Λάρνακα; Εκκλησία Αποστόλου Βαρνάβα, Λάρνακα (περιοχή Κρασιά); 8.30 π.μ.-5.30 μ.μ.; 34.908236; 33.593466; https://www.google.com/maps/place/34.908236,33.593466
Λάρνακα; Πνευματικό Κέντρο Αγίου Σάββα, Λειβάδια; 8.30 π.μ.-5.30 μ.μ.; 34.948353; 33.635116; https://www.google.com/maps/place/34.948353,33.635116
Λάρνακα; Οίκημα Σωματείου «Ερμής Αραδίππου», Αραδίππου; 8.30 π.μ.-5.30 μ.μ.; 34.952592; 33.591421; https://www.google.com/maps/place/34.952592,33.591421
Λάρνακα; Κοινοτικό Συμβούλιο Κιτίου; 8.30 π.μ.-5.30 μ.μ.; 34.848021; 33.571217; https://www.google.com/maps/place/34.848021,33.571217
Λάρνακα; Κοινοτικό Συμβούλιο Ξυλοφάγου; 8.30 π.μ.-5.30 μ.μ.; 34.976600; 33.844103; https://www.google.com/maps/place/34.976600,33.844103
Λευκωσία; Χώρος στάθμευσης λούνα παρκ «Παπαφιλίππου», Μακεδονίτσσα; 8.30 π.μ.-5.30 μ.μ.; 35.164343; 33.317178; https://www.google.com/maps/place/35.164343,33.317178
Λευκωσία; Εκκλησία Αγίου Σπυρίδωνα, Λευκωσία (πίσω από Αστυνομικό Σταθμό Λυκαβητού); 8.30 π.μ.-5 μ.μ.; 35.163514; 33.363405; https://www.google.com/maps/place/35.163514,33.363405
Λευκωσία; Εκκλησία Αγίου Γεωργίου, ʼγιος Δομέτιος; 8.30 π.μ.-5.30 μ.μ.; 35.171180; 33.333176; https://www.google.com/maps/place/35.171180,33.333176
Λευκωσία; Εκκλησία Αποστόλου Ανδρέα, Αγλαντζιά (Λεωφόρος Κυρηνείας); 8.30 π.μ.-5.30 μ.μ.; 35.148572; 33.390159; https://www.google.com/maps/place/35.148572,33.390159
Λευκωσία; Ιερός Ναός Παναγίας Ευαγγελίστριας, Παλουριώτισσα; 8.30 π.μ.-5.30 μ.μ.; 35.176334; 33.379155; https://www.google.com/maps/place/35.176334,33.379155
Λευκωσία; Εκκλησία Αγίου Πολυδώρου, Καϊμακλί; 8.30 π.μ.-5.30 μ.μ.; 35.188567; 33.392407; https://www.google.com/maps/place/35.188567,33.392407
Λευκωσία; Εκκλησία Αγίου Γεωργίου, Λατσιά; 8.30 π.μ.-5.30 μ.μ.; 35.104257; 33.380215; https://www.google.com/maps/place/35.104257,33.380215
Λευκωσία; Εκκλησία Αγίου Στυλιανού, Συνοικισμός Άσπρες, Λακατάμια; 8.30 π.μ.-5.30 μ.μ; 35.121309; 33.324843; https://www.google.com/maps/place/35.121309,33.324843
Λευκωσία; Ιερός Ναός της Του Θεού Σοφίας, Στρόβολος; 8.30 π.μ.-5.30 μ.μ.; 35.147430; 33.334673; https://www.google.com/maps/place/35.147430,334673
Λευκωσία; Δημαρχείο Στροβόλου; 8.30 π.μ.-5.30 μ.μ.; 35.143994; 33.343486;  https://www.google.com/maps/place/35.143994,33.343486
Λευκωσία; Εκκλησία Αγίου Δημητρίου, Ακρόπολη; 8.30 π.μ.-5.30 μ.μ.; 35.151850; 33.359092; https://www.google.com/maps/place/35.151850,33.359092
Λευκωσία; Δημαρχείο Γερίου; 8.30 π.μ.-5.30 μ.μ.; 35.105760; 33.417926; https://www.google.com/maps/place/35.105760,33.417926
Λευκωσία; Ιερός Ναός Αγίου Γεωργίου, Δευτερά; 8.30 π.μ.-5.30 μ.μ.; 35.083146; 33.270883; https://www.google.com/maps/place/35.083146,33.270883
Λευκωσία; «Σπίτι του Εθελοντή», Κοκκινοτριμιθιά; 8.30 π.μ.-5.30 μ.μ.; 35.151416; 33.230894; https://www.google.com/maps/place/35.151416,33.230894
Λευκωσία; Κέντρο Υγείας Ιδαλίου; 8.30 π.μ.-5.30 μ.μ.; 35.013276; 33.425797; https://www.google.com/maps/place/35.013276,33.425797
Λευκωσία; Αίθουσα εκδηλώσεων κοντά στο Δημοτικό Σχολείο Λυμπιών; 8.30 π.μ.-5.30 μ.μ.; 35.001485; 33.463952; https://www.google.com/maps/place/35.001485,33.463952
Λευκωσία; Κοινοτικό Συμβούλιο Ευρύχου; 10 π.μ.-5.30 μ.μ.; 35.038667; 32.900098; https://www.google.com/maps/place/35.038667,32.900098
Πάφος; Πρώην Οικία Επάρχου, Πάφος (Οδός Γρίβα Διγενή); 8.30 π.μ.-5.30 μ.μ.; 34.772022; 32.431229; https://www.google.com/maps/place/34.772022,32.431229
Πάφος; Προαύλιος χώρος στάθμευσης ERA KORIVOS (Λεωφόρος Δημοκρατίας 2, παρά το Παφιακό Στάδιο); 8.30 π.μ.-5.30 μ.μ.; 34.768627; 32.441636; https://www.google.com/maps/place/34.768627,32.441636
Πάφος; Αίθουσα Πολλαπλών Χρήσεων Κοινοτικού Συμβουλίου Έμπας; 8.30 π.μ.-5.30 μ.μ.; 34.806745; 32.424750; https://www.google.com/maps/place/34.806745,32.424750
Πάφος; Ταχυδρομείο, Πλατεία Γεροσκήπου; 9.30 π.μ.-6 μ.μ.; 34.759771; 32.453620; https://www.google.com/maps/place/34.759771,32.453620
Αμμόχωστος; Πνευματικό Κέντρο Μητροπολιτικού Ναού Παραλιμνίου (δίπλα από τη Μητρόπολη); 8.30 π.μ.-5.30 μ.μ.; 35.038959; 33.982790; https://www.google.com/maps/place/35.038959,33.982790
Αμμόχωστος; Εκκλησία Αγίας Νάπας, Αγία Νάπα; 8.30 π.μ.-5.30 μ.μ.; 34.989318; 33.999798; https://www.google.com/maps/place/34.989318,33.999798
Αμμόχωστος; Κοινοτικό Συμβούλιο Φρενάρους; 9.30 π.μ.-5.30 μ.μ.; 35.036910; 33.918264; https://www.google.com/maps/place/35.036910,33.918264